{
  "version": 1,
  "high_confidence_threshold": 0.65,
  "low_confidence_threshold": 0.35,
  "primary_match_threshold": 0.3,
  "secondary_match_threshold": 0.2,
  "iou_weight": 0.75,
  "max_normalized_center_distance": 1.5,
  "max_area_ratio": 6.0,
  "max_track_age_seconds": 2.0,
  "max_prediction_seconds": 1.0,
  "max_active_tracks": 128,
  "max_frame_detections": 128
}
